{
  "skill_name": "e503_high_priv_without_boundary",
  "skill_dir": "D:\\GM-SkillForge\\run\\T5_evidence\\pattern_samples\\e503_high_priv_without_boundary",
  "analyzed_at": "2026-03-15T14:30:20Z",
  "pattern_set_version": "1.0.0-t5",
  "analysis_statistics": {
    "files_analyzed": 1,
    "functions_analyzed": 3,
    "total_matches": 7,
    "by_pattern": {
      "E501_EXTERNAL_WITHOUT_STOP_RULE": 2,
      "E503_HIGH_PRIV_WITHOUT_BOUNDARY": 3,
      "E504_MISSING_AUDITABLE_EXIT": 1,
      "E502_RETRY_WITHOUT_IDEMPOTENCY": 1
    },
    "by_category": {
      "governance_gap": 6,
      "anti_pattern": 1
    }
  },
  "pattern_matches": {
    "critical": [
      {
        "pattern_code": "E501_EXTERNAL_WITHOUT_STOP_RULE",
        "pattern_name": "External Action Without Stop Rule",
        "file_path": "skill.py",
        "line_number": 12,
        "function_name": "batch_delete_files",
        "category": "governance_gap",
        "severity": "CRITICAL",
        "message": "External action (HTTP request, file write, subprocess) executed without preceding governance stop rule (permission check, authorization, permit validation)",
        "snippet": "def batch_delete_files(file_paths: list[str]) -> int:",
        "context_lines": [
          "import sqlite3",
          "",
          "",
          "def batch_delete_files(file_paths: list[str]) -> int:",
          "    \"\"\"",
          "    Delete multiple files.",
          ""
        ],
        "suggested_fix": "Add stop rule before external action: @require_permission decorator or explicit permission check",
        "evidence_source": "run/T5_evidence/pattern_samples/e501_external_without_stop_rule/skill.py"
      },
      {
        "pattern_code": "E503_HIGH_PRIV_WITHOUT_BOUNDARY",
        "pattern_name": "High-Privilege Call Without Boundary",
        "file_path": "skill.py",
        "line_number": 12,
        "function_name": "batch_delete_files",
        "category": "governance_gap",
        "severity": "CRITICAL",
        "message": "High-privilege operation (file delete, database write, system command) executed without boundary limits (rate limit, resource cap, scope restriction)",
        "snippet": "def batch_delete_files(file_paths: list[str]) -> int:",
        "context_lines": [
          "import sqlite3",
          "",
          "",
          "def batch_delete_files(file_paths: list[str]) -> int:",
          "    \"\"\"",
          "    Delete multiple files.",
          ""
        ],
        "suggested_fix": "Add boundary limits: rate limiter, resource cap, or scope restriction",
        "evidence_source": "run/T5_evidence/pattern_samples/e503_high_priv_without_boundary/skill.py"
      },
      {
        "pattern_code": "E503_HIGH_PRIV_WITHOUT_BOUNDARY",
        "pattern_name": "High-Privilege Call Without Boundary",
        "file_path": "skill.py",
        "line_number": 32,
        "function_name": "bulk_database_insert",
        "category": "governance_gap",
        "severity": "CRITICAL",
        "message": "High-privilege operation (file delete, database write, system command) executed without boundary limits (rate limit, resource cap, scope restriction)",
        "snippet": "def bulk_database_insert(records: list[dict]) -> int:",
        "context_lines": [
          "    return deleted_count",
          "",
          "",
          "def bulk_database_insert(records: list[dict]) -> int:",
          "    \"\"\"",
          "    Insert records into database.",
          ""
        ],
        "suggested_fix": "Add boundary limits: rate limiter, resource cap, or scope restriction",
        "evidence_source": "run/T5_evidence/pattern_samples/e503_high_priv_without_boundary/skill.py"
      },
      {
        "pattern_code": "E501_EXTERNAL_WITHOUT_STOP_RULE",
        "pattern_name": "External Action Without Stop Rule",
        "file_path": "skill.py",
        "line_number": 56,
        "function_name": "run_batch_commands",
        "category": "governance_gap",
        "severity": "CRITICAL",
        "message": "External action (HTTP request, file write, subprocess) executed without preceding governance stop rule (permission check, authorization, permit validation)",
        "snippet": "def run_batch_commands(commands: list[str]) -> list[str]:",
        "context_lines": [
          "    return inserted",
          "",
          "",
          "def run_batch_commands(commands: list[str]) -> list[str]:",
          "    \"\"\"",
          "    Execute multiple system commands.",
          ""
        ],
        "suggested_fix": "Add stop rule before external action: @require_permission decorator or explicit permission check",
        "evidence_source": "run/T5_evidence/pattern_samples/e501_external_without_stop_rule/skill.py"
      },
      {
        "pattern_code": "E503_HIGH_PRIV_WITHOUT_BOUNDARY",
        "pattern_name": "High-Privilege Call Without Boundary",
        "file_path": "skill.py",
        "line_number": 56,
        "function_name": "run_batch_commands",
        "category": "governance_gap",
        "severity": "CRITICAL",
        "message": "High-privilege operation (file delete, database write, system command) executed without boundary limits (rate limit, resource cap, scope restriction)",
        "snippet": "def run_batch_commands(commands: list[str]) -> list[str]:",
        "context_lines": [
          "    return inserted",
          "",
          "",
          "def run_batch_commands(commands: list[str]) -> list[str]:",
          "    \"\"\"",
          "    Execute multiple system commands.",
          ""
        ],
        "suggested_fix": "Add boundary limits: rate limiter, resource cap, or scope restriction",
        "evidence_source": "run/T5_evidence/pattern_samples/e503_high_priv_without_boundary/skill.py"
      }
    ],
    "high": [
      {
        "pattern_code": "E504_MISSING_AUDITABLE_EXIT",
        "pattern_name": "Missing Auditable Exit",
        "file_path": "skill.py",
        "line_number": 12,
        "function_name": "batch_delete_files",
        "category": "governance_gap",
        "severity": "HIGH",
        "message": "Function performing sensitive action without writing auditable exit record (audit log, evidence file, gate decision record)",
        "snippet": "def batch_delete_files(file_paths: list[str]) -> int:",
        "context_lines": [
          "import sqlite3",
          "",
          "",
          "def batch_delete_files(file_paths: list[str]) -> int:",
          "    \"\"\"",
          "    Delete multiple files.",
          ""
        ],
        "suggested_fix": "Add audit event writing before returning from sensitive operation",
        "evidence_source": "run/T5_evidence/pattern_samples/e504_missing_auditable_exit/skill.py"
      },
      {
        "pattern_code": "E502_RETRY_WITHOUT_IDEMPOTENCY",
        "pattern_name": "Retry Without Idempotency Protection",
        "file_path": "skill.py",
        "line_number": 56,
        "function_name": "run_batch_commands",
        "category": "anti_pattern",
        "severity": "HIGH",
        "message": "Retry loop detected without idempotency protection mechanism (idempotency key, deduplication check, transaction guard)",
        "snippet": "def run_batch_commands(commands: list[str]) -> list[str]:",
        "context_lines": [
          "    return inserted",
          "",
          "",
          "def run_batch_commands(commands: list[str]) -> list[str]:",
          "    \"\"\"",
          "    Execute multiple system commands.",
          ""
        ],
        "suggested_fix": "Add idempotency key check before executing operation in retry loop",
        "evidence_source": "run/T5_evidence/pattern_samples/e502_retry_without_idempotency/skill.py"
      }
    ],
    "medium": []
  },
  "governance_gaps": []
}